Name,Teacher ID,Department,Rating,Difficulty,Total Ratings,Would Take Again,Rating Class,Comments,Top Tags
Shashi Shekhar,578954,Computer Science,2.2,25%,25,25%,poor,"{'CSCI5715': ['Homeworks have very low weightage, most of the grade is based on the mid term and final exam. Exams are long & time consuming. I did not learn much from the course, neither did I find the lectures interesting. This seems like a GIS course, I do not understand why they are listing it in CSCI. I would avoid this course and the instructor.', 'Professor wrote the textbook, but hardly uses it. Lectures cover many topics, but hardly give you real definitions or approaches for how to solve any problems. Tests and assignments are written with no effort. I learned little, this wasted my time. The only thing that made this course difficult was the lack of a real professor (not a researcher).', 'Very helpful TA. He even gave us extra time during the exam.', 'Shashi is a nice guy. But the course material is dry and outdated. Topics covered are not helpful for data science jobs in the industry. I would avoid 5715.', ""Don't even know where to begin on this class. Most frustrating professor to deal with, and his lectures are all snooze fests from start to finish, the slides being the exact same as the textbook. An unserious class that took way more effort than needed, and ironic that a database management systems class is unorganized."", 'The most disorganized overly-organized class. Homework amount was disproportionate for only 3 credits. Boring course.', ""Unorganized, unprofessional, and extremely boring are the 3 most accurate words to describe this course. There were always numerous errors in the exams, homework, and even solutions, that if you don't catch them on your own or are not aware of the announcements, you're screwed! And if that's not crazy enough, midterm and final is 30% each!"", ""The most disorganized class I have ever taken. There are 5 TAs and a professor yet he has the students check his homework assignments ahead of time to make sure there aren't errors in it? The material is fairly easy and pretty applicable, just made difficult by poor lectures and organization. I do not go to lectures because they are dry and slow.""], 'CSCI4707': ['This class requires a lot reading and self studying. The course topic is relevant and is interesting if you are trying to get into data infrastructure engineering.', ""Extremely disorganized. The TA's don't know what they are doing. There are so many typos on the exams, homeworks and labs. Grading criteria is very vague. 30% of our grade is a single exam....?!?! The homework's are so unnecessarily long. For our exam, we were interrupted like 6 times for TA's and professor's to clarify mistakes. Don't take him."", 'Great researcher, pretty bad at teaching and managing a class. Ambiguous, wishy-washy question writing on assignments and exams, a super wide coverage of course content but not big in depth. Sadly the TA did not help this semester and was also guilty of pulling out some random substantiation for a claim when convenient.', 'This course is very helpful and inspiring. Reasonable workload and fabulous lectures. In addition, the professor always answered my questions with great patience and respect. Very recommended.', 'Exams were a little rough, but they might be different in person.', 'Shashi is a caring professor who is passionate about his work. The only problem is that the lectures are quite dry, but that may just be due to the material covered in this class.', 'He is a caring person, however, the class is generally unorganized. The class webpage is somewhat cluttered. Assignments and exams are lengthy to a fault.', 'He gives out wayy too much homework for a labless course.', 'An extremely rude individual who just looks down upon other people and professions. Is quite outdated in his knowledge of the subject and latest industry practices. Should be more humble.', ""Lectures are mostly pointless and boring. Getting a good grade on the exams is what your grade is based on because the class in on a curve and everyone gets A's on the homeworks. The exams cover topics he glossed over in lecture and is long. I spent days preparing for the exams and still did not get a good grade. Tests cover so much material."", 'Exams are unnecessarily long. No calculator allowed on exam but large calculations are required. Homeworks are on the easy side however the entire class is graded on a curve and everyone does well on the homeworks... so your entire grade is dependent on your test results. Lectures are really boring, most of the class stopped attending', 'Exams far too long and worth too much of your grade @ 60%. Boring powerpoint lectures. Life is short, avoid this class. Self study the topics instead and take another class.']}","['Test heavy', 'Lots of homework', 'Lecture heavy', 'Graded by few things', 'Get ready to read']"
Jaideep Srivastava,402512,Computer Science,2.7,22%,58,22%,average,"{'CSCI4707': ['Worst Professor I am surprised he is even a Director of Undergraduate Studies for Data Science. He uses slides that are from a book, and not fully finished, the final grading rubric is ranking students?!?  I called him during his office hour and he was eating food while answering my question and in the middle just goes ""I have a meeting I gotta go""', ""Took the Summer class and we didn't get ANY grades until 3 days before the final day of class. He just reads off of slides verbatim to the point where you do 90% of learning outside of class. I think they're pretty lenient in terms of grading and the exams weren't bad, but not giving us grades on the he or practice exams answers is a huge problem."", 'Lectures were useless. He goes on 30-minute unhelpful tangents. Must self-teach from the book and internet. Homeworks include topics not even mentioned in lectures. There were no instructions, grading criteria, or feedback provided on the final project. No mention of the grade scale or a curve, and final grades do not match any standard scale.', ""Most terrible professor I've ever taken. Super disorganized, unprepared, no rubric, no criteria, no grading scale. I learn nothing from him. All my knowledge is either from the book or online. AVOID AT ALL COST."", ""This course was by far the most disorganized course I have taken. The final project had no instructions nor rubric, but was still graded harshly. The professor is often late for class and has us stay late. 1 assignment was posted at 8:00pm, closed at 12:00am, and we were told to make it up at his 1 office hour during peak class-hours (we couldn't)."", 'For the course: Reads from slides, vague grading criteria. The bigger picture: as an intro course, he covers a wide breadth of material with practical knowledge everywhere. Covers lots of technologies and the cutting edge. Very knowledgeable and nice professor. If you want to learn the right mindset for DB technologies, this is the class to take.', ""I have never had a professor so unprepared for a class. He didn't have a description nor a rubric for the project that is worth 20% of the grade. All we got was some examples from past years. Almost all his lectures were ripped directly from the book material with him adding very little. Save yourself a headache and take DB with Shana."", ""He sometimes seems to be reading content on slides for the first time along with us. 2 exams carry 50% of grade. Extremely tough when evaluating projects. No one got above 90% of project score. All assignments are from textbook. And they seem like random problems which don't help in understanding material. He clearly doesn't want to teach"", 'Took it in the Fall 2021 semester, I gotta say that the grading was a little weird. The professor was very nice and explained things if you asked. The grading at the end seemed rushed and it was like they just put a score on everything. Not much instruction on what the project was supposed to be like, just some examples. Got lucky and did good tho.', '25% of students withdrew from this class. What else can I say.', ""I found the lectures a bit dry and found myself zoning out which is unusual for me. He used the slides from the book's websites which was fine for me because I could take notes on the slides. Tests weren't bad and neither was the homework(3 written, 2 programming). He definitely knows what hes talking about but you might have to read for some q's."", ""GREAT PROFESSOR ! LECUTURE DOES GET BORING IF YOU DONT READ THE CHAPTER BEFORE YOU GO TO CLASS. SPECIALLY MEGHNA , TA FOR THIS CLASS. YOU SEND HER EMAIL AT MID NIGHT SHE WILL RESPOND. SHE IS ALWAYS AVAILABLE SHE IS THE BEST. I SEE SO MANY PPL HERE SAYING BAD THINGS I GUESS THEY DIDN'T DO WELL IN CLASS. FOR THAT BLAME URSELF NOT THE PROFESSOR.""], 'CSCI5707': ['I thought he was very clear, though a bit slow, in his lectures. I enjoyed learning new material in the class, and the professor motivated the different topics pretty well. Previous ratings are a bit old, but I did not find the assignments or exams too difficult.', ""He seemed to know what he was talking about, but he really only just reads from textbook-provided lecture slides and assigns homework from the text, as well. His lectures are dry, but the content wasn't too hard. I did poorly because I outright skipped one of the assignments. All-in-all, fine."", ""Get ready to teach yourself. Lecture is nothing more than an overview of topics. You need to read the book in detail to have a chance of passing. Homework problems from the book are seemingly selected randomly and are not an indicator for what'll be on the exam. I regret taking this course with him. I don't want it spoon fed, but this was sad."", 'Teaching one thing, but test on another thing. You can get B even if you think you are well prepared and did well in assignments. Learned little from the class. The worst course I have ever taken.', '4707 was an incredibly dull class. The lectures were not engaging in the least, and as many have said, slides were adopted straight from the book\'s website. Also, if you want to actually learn SQL, I wouldn\'t recommend this professor. You won\'t actually use a computer, and any ""coding"" you do will be with pen/paper.', 'He is a professor here solely for his research. He puts little to no effort in to teaching. His slides are straight from the book website and adds very little extra information. Be prepared to read the textbook thoroughly and know many definitions for tests. His definition of ""non-cumulative"" is also questionable.'], 'CSIC5707': ['Do not take unless you have a interest in databases stronger than your self-respect. Long, boring lectures using slides from the textbook publisher. Tests involve a lot of random definitions you are expected to recall on the spot, rather than applying knowledge.', ""Don't need to say what already has been said, just gonna add my yiiiiiiiiiiiiiiiiiiikes here and move on. Do not take this guy's course. It's not worth hedging your grade on two midterms worth 60% total, where you have no idea what's going to be on them.""]}","['Get ready to read', 'Group projects', 'Graded by few things', 'Test heavy', 'Tough grader']"
Carl Sturtivant,143828,Computer Science,3.7,51%,210,51%,good,"{'CSCI2033': [""Professor Carl's lectures are quite theory-heavy, making it challenging to grasp the practical applications of linear algebra. The textbook can be tough, but with the help of unstuck study AI and working closely with TAs, you can succeed in this course."", 'I actually felt like I was learning from Carl. He generally teaches enough in lecture to get a start on the homework but you will have to think about things before you can do the hw. He has 7-8 hws worth 8% of your grade each and a final which is quite easy worth 30%.', 'Carl Sturtivant was a good professor to have for CSCI 4041 in my opinion. He always tried to explain new concepts in the most simple way he could, using first principles. Furthermore, his class has an emphasis on homework rather than exams, which suits my learning style well.', 'Never answered questions in a helpful way, I learned more in my discussion than in lecture'], 'CSCI4041': [""I've made an effort to seek out Sturtivant, after taking 2033 last spring. He believes in heavily theoretical lectures, hard homeworks (with low weight), and easy tests (with high weight), so you're forced to learn how to use the theory, a necessary skill in CS. This is what it means to be an applied thinker. If you are unable to do this, avoid."", 'His lectures are tough to understand. I rarely understand linear algebra through his lectures. I have to find TAs to help me understand. Also, the textbook he chooses is hard to understand as well. If you have to choose his course, try your best to make your cheat sheets as complex as possible.', 'i wish he was my dad', 'He knows his stuff but the lectures are all theory based and never applied to computer science. It makes it hard to learn the content and becomes more memorization for the quiz then forget it. Would not recommend for someone who actually wants to apply linear algebra. Great for someone who wants to learn the theory behind it all.'], '4041': ['I had Carl in 4041 last year and now have him in 4011. His lectures are amazing and have good clarity on theory and proof.', ""I respect the fact that he only had 7 assignments throughout the semester and a midterm and final that really were not super hard. The deal is this is a really important class with core concepts of CS as a whole, and he's just too theoretical and proofy for things that dont have to be that deep, like man relax, youre at the U not oxford."", 'This is a very proof-heavy class, your grade is pretty much made up of weekly quizzes and a final. You get a lot of partial credit though but be prepared, doing textbook problems helps a lot! \n\nCarl is a nice professor and explains topics pretty well.', ""I've now taken 2033, 4041, 4011, and 5421 with Carl, completely by chance, and I think that Carl is a good professor. However, his courses are tough, and are built with a hardworking student in mind. Back when I took 2033, ALL OF IT went straight over my head (completely theory), but now in 5421, I see it as tough but doable. Go hard or go home! (:"", ""Carl is a funny and nice person. However, the way he teaches linear is more like taking discrete math than a calc class; lots of proofs. Talking with others who are taking 2033 with other professors, they had no idea what we were doing when looking at our homework. Linear is important for learning AI/CV. Don't take it with Carl."", 'His instruction is hard to understand and he only goes through proofs during the whole lecture. We mainly learn it by reading the textbook ourselves or finding the TAs. Also, he provides no make-up quizzes.', ""Carl has a reputation at the U so I was excited to have him but sadly it wasn't as good as I expected. His lectures are all theory and very haphazard. Homework is almost impossible. The times I asked for help he was rude. He says his exams are easy but they were always hard. 30% final. No curves. Luckily grading is shifted down so 60% is C level"", ""I can tell that Carl is really knowledgeable and smart, but I struggled in class due to the nature of how theoretical the lectures were. In addition, the quizzes took WEEKS to grade. It wasn't until the last three weeks of the semester that quizzes 5-10 were graded (the number might be wrong--but roughly around there).""], '4011': [""Prof. Sturtivant was a good lecturer, albeit a bit dry from time to time. He didn't publish any lecture notes or recordings, but he taught the class well. My biggest gripe with the class was that some assignments took 4-5 weeks to be graded. The exams were easy (as he will admit), but the homework can be a bit time-consuming (although worth it!)"", 'I was taught mostly only what I needed to know. Was tested on the fact that I learned a little of what I needed to know.'], '2011': ['Carl is by far the worst professor i have ever had. His lectures are very theorem heavy, and its better to just not go and self study. he does not make lecture videos free and instead asks for 400 dollars (100 follars for every credit) to get lecture videos the day of or get them 10 days later for free.', ""Carl's lectures were extremely theoretical and proof based. He didn't do many examples in class which made it hard for me to understand material. His weekly exam's were always pretty easy but the textbook that was required was often times hard to understand without supplemental material. I would try to avoid him.""]}","['Respected', 'Amazing lectures', 'Clear grading criteria', 'Lots of homework', 'Get ready to read']"
Ju Sun,2680575,Computer Science,2.9,45%,18,45%,average,"{'CSCI2033': ['Professor Sun makes this class incredibly accessible and easy to follow along. It is clear in the grading criteria and the projects that he cares more about student comprehension of the materials rather than making sure students can spit out certain answers for a test. Highly recommend for this class.', 'One of the better math courses I have taken at the U. The weekly quizzes were easy to study for as he posted practice questions that were nearly identical to the quiz questions. Open notes for exams and the final and the homework assignments were not terrible but a little tedious and hard to test without an autograder like other CS courses.', 'ju sun obvious knows what he is teaching, and its clear he it quite passionate about it. but his style of lecturing was quite confusing for me, but luckily the material wasnt that hard tbh. everything was open notes and textbook, he lets you drop few quizzes and a project, and he gave a few extra credit. 10/10 if he lectured slightly cleaner', 'Professor Sun really want to improve the students\' experience in class. The class is actually organized. The quizes and assignments are easy as long as you do the homework after each class. The assignment is using python, which is very helpful to students because we will learn about a very popular machine learning package ""Numpy"".', 'Very well paced lectures and his explanations are very clear as he explains each concept in multiple ways. He prereleases some textbook reading for us to read ahead (not mandatory), which I found very helpful.', ""The department needs to to take action with this man's lecture methods. Embarrassing that he has already been receiving such feedback for years already yet has made no changes. He obviously is math smart but a complete moron in the sense of logistics."", 'good teaching but hard/unclear projects(although u can drop 1 of the 3 projects)', 'AVOID!!', 'I got ghosted by him for half the semester for an assignment regrade. He said he would get it done but it appears he forgot about it even with reminders! Exams were tough, but he gave out a lot of partial credit. Lectures were generally a big mess.', 'Lectures were confusing and poorly organized. Best days were when guest lecturer taught! Very condescending professor who expects you to understand complex material right away. Exams are extremely difficult. Unreasonable amount of work for this class. Take ANY other professor if possible!!', 'Avoid this professor if you can. Lectures are chaotic and unorganized. Assignment instructions are confusing. Also he is not kind to students with disabilities.', 'This is the best course at UoM in modern deep learning, covering both theory and applied components. The course was math-heavy and intense, and I find the professor very dedicated.', 'Very recommend this course if you are interested in machine learning!', 'Professor is great, personable, and is very passionate about teaching things right. His lectures are more oriented towards theory, focus more on subtle details, and ensure that students understand the concepts and comprehend the intuition behind the ideas. His office hours are beneficial, and I would definitely recommend taking his class.', ""don't understand what he teaches in class. I hope he can improve his lectures and make it more organized so students can understand what he says. Also posting hw on Fridays and send emails on Saturdays and holidays. I don't recommend this professor for now."", ""Completely unprepared for every lecture. Behind schedule by over a month. Writes over his own notes so everything becomes a mess within minutes. Doesn't explain what anything he is doing is used for. Does not respond to any emails. Basically, if you do not catch him in class you will not hear from him. Acts like he is above everyone and is snarky."", 'His lectures are enjoyable but they dont excuse his lack of organization and how poorly structured his class is. Never covered all the topics he promised but delayed assignments by months that were on much older topics. Avoid his class if you can', ""This class was a disaster. Deadlines were delayed months and the last third of the semester was never taught. The professor would be late in posting notes and assignments but would send snide emails about students who asked why the notes weren't up. A nightmare. Would not recommend this professor under any circumstances.""]}","['Tough grader', 'Lecture heavy', 'Test heavy', 'Get ready to read', 'Amazing lectures']"
