Name,Teacher ID,Department,Rating,Difficulty,Total Ratings,Would Take Again,Rating Class,Comments,Top Tags
Mohamed Mokbel,1803908,Computer Science,2.5,38%,20,38%,average,"{'CSCI5708': [""His lectures are effective and the assignments he gives are reasonable and helpful for learning more in the topics from class. He is also a fair grader. If you are actually interested in the topic please don't let the other reviews turn you away, he is a very passionate and knowledgeable professor who can help a lot with understanding the material."", 'He clearly cares a ton about the students and is very knowledgeable. The class is generally not too hard, although lab 2 is very difficult compared to everything else. Lectures are not graded, but going to them is very important since they go over many more examples than just the slides cover. Everything is leniently graded, including exams.', ""He's accent is bit difficult to understand. Tests not difficult but he would test the class on contents being practiced on the homework that's due a week after the test, which leads to many people not getting feedback on how they did on their homework, which then leads to poor test performance. I'd avoid his version of 4707 as much as possible."", ""I especially recommend going to office hours; the content isn't hard, but it can be tricky, especially for people without prior database experience. Once you get it , you'll be fine, but you might need that extra push to absorb it all. Lectures are good, homeworklabs are fine, but tests are hard. No trick questions though, lecture slides cover it.""], 'CSCI4707': ['DO NOT TAKE HIM. Hws content are very different from what we learned and getting resources to do the hw is almost impossible. The final is one of the worst finals ive ever taken. I wish I knew how he chose to put in these questions and also why he wont give us practice exams. Please do not take this class with him.', ""Don't think you can do good on final just because you did great on homework, cuz' they like to ask you questions you never learned how to solve before! PLUS YOU GET NO PRACTICE FOR EXAMS WHATSEVER!!!"", 'First off, he has a very thick accent which can be hard to understand at all sometimes. He reads off the slides in class which do a terrible job at actually explaining the topics then tests and gives homework on examples not covered in class. The book is also very unclear on examples. There is no outside learning possible as everything is specific.', 'good', ""This professor is the hardest professor to understand that I've ever had. He has an extremely thick accent and his main mode of explanation is illegible handwriting. He also will talk about his next slides without actually showing them, then skips over them so quickly that I had no time to jot down notes. I recommend staying far away from this prof"", 'Not understand the accent. Will never choose this course if viewing the comments here. Self learning is much better a choice.', ""His classes aren't on the sexiest topics, but wow he's good at explaining. MAKE SURE YOU PARTICIPATE to get the most out of it. I'm very happy I took his class."", ""Lectures weren't always the most interesting, especially as a night class, but the professor explained concepts clearly. Much of the grade is based on homework and projects which weren't awful, but required some time and thought. The TAs for the course were among the best I've ever had, they graded quickly and were very helpful in office hours."", ""Lectures are boring, but informative, aside from the slides being older than most of my classmates.  Labs don't reinforce lessons.  Tests are more memorization than practical knowledge.  Tests are half of grade.  No syllabus to speak of.  Vague lab requirements.  TAs graded fast is probably only plus from this class/instructor for me."", 'Super heavy accent. Ridiculous high curve at the end. Tests are super long and HARD, make sure you DO NOT hesitate on a concept. If you were not sure, guess one and move on. This is the best proved by experience to get highest possible grade. Useless labs but time consuming.  Not recommend this prof. NOT a course for SQL. Mainly about low level', 'Had him also for 4707 and the content was the same only slightly harder. Labs involve modifying an open source database which can be hard, but is interesting. Tests are mostly things covered in class/homework but there are usually 1 or 2 hard questions that test your understanding. I found the book extremely useful. Overall, positive experience.', 'Very good lecturer. Tests are easy if you do the homework.'], '4707': ['He never gives out practice exams and tests on the knowledge of something that was not emphasized or shown on assignments.', 'Professor Mokbel explains concepts and their examples well, but the lack of online resources makes his course hard to interact with. When I went back to study, often times examples discussed in class were not filled out on the lecture slides, or the slides themselves were far too brief to make sense on their own. TLDR: writing notes is required.'], 'CSCI4041': [""His accent is already thick, but then he speaks way too fast and stutters through his confusing slides that he's constantly skipping through before you can take notes. Homework is detached from the course material, and even though he always mentioned a curve (because averages were so low), it seems if there was a curve, it was on the way lower end."", ""The thing you learn the most, in this course, is how to do time intensive things fast and sloppily. If you're lucky you'll become an expert at reading broken English. It's one thing to have a very thick accent, it's another thing to proof-read questions on a test.""]}","['Tough grader', 'Get ready to read', 'Tests are tough', 'Lots of homework', 'Test heavy']"
Chad Myers,1393807,Computer Science,4.2,82%,36,82%,good,"{'CSCI5461': [""This class with this professor was extremely heavy in homework and projects, and requires a large amount of outside work. The lectures didn't really explain much actual application, so get ready to learn everything yourself. Although there is a lot of material, the way it's taught is extremely confusing. Id recommend self-study over this professor."", ""In lecture, Myers tries to divide the information between bio and csci, but it just leaves both sides of the room confused. The lectures were really hard to stay engaged in, and any supplementary material and homework didn't explain anything either. If your looking for an A, take this professor. If you want to learn, take one of the other classes."", ""Chad was a good professor. He was also a fair grader and cares for his students. The only issue my classmates and I had were his homework assignments were extremely difficult and long for us. And I think we thought that because we were mostly non-programming students, so it was a real struggle. Otherwise, I learned a lot in Chad's class."", ""Great professor, lectures are presented clearly and he gives very thoughtful responses to any questions from class. Stay on top of projects as the workload can pile up quickly. Quizzes were also straightforward and TA's are helpful resources. Will definitely look to take more classes with Chad in the future."", ""While I would say that this class was enjoyable and I learned a lot, Chad could do more to keep the lectures engaging. On one hand, it's hard to hold the attention of students during a 2 1/2 hour lecture, but on the other, there could've been more student engagement, better slideshows (less bland), and more than the one 7 minute break provided."", ""Chad is a true chad. Came in with zero java experience and did just fine. I don't even have much experience with coding either, but he helped me learn a lot. He's a great lecturer and explains topics well. If you start your projects EARLY (this is super important) and also study at least a week in advance for the tests it'll be a very doable class.""], 'CSCI1933': ['I took this class believing the reviews oh lord. This class is so hard you would have to stay on zoom for good 40 minutes for a Ta to even help you. You will only pass this class if you have background experience in JAVA. The teacher is nice but the class itself..... be prepared to give it your all and your soul.  happy I am done with this trauma', 'Chad is a good lecturer, although they tended to get boring (it was a 150 minute lecture, not really his fault. Hard to stay focused that long). 5 projects, 3 midterms, and 12 labs. So well on projects and youll do good. I got 58% the first midterm, but got 98% on my 5 projects and Im currently at an A-. Highly recommend for CSCI1933', ""At first, I was not a fan of Chad. But this class is good in that it forces you to learn outside of class. It's a jump from 1133 but it's necessary to help a student's growth. If this is your first exposure to Java, there will be a learning curve. But, it is well worth it in the end. Chad's lectures are good if you keep up outside of class."", 'Bad teacher. Skipped class did better than most on tests. Takes a week+ to respond to emails if at all.', ""Professor Myers was an amazing teacher and was very kind and willing to help students outside of class. I went into this class with no coding experience and didn't struggle too much. I found the higher level bio/genetics topics confusing and sometimes it seemed like only the graduate students were being lectured to. Overall, I loved this class."", ""Great vibe and welcoming learning environment. The lectures were slow at some points but bearable. Exams were each take home and we were allowed 24 hours to complete it (more than enough time since they were written to take 1.5 hours). Help is accessible from TA's and Professor essentially everyday. Some labs did take an extensive amount of time."", 'Prof Myers was a great professor who taught the material in a VERY clear way. He is always open to speak to you after class and during office hours too. There are regular lab assignments, which can be very time consuming sometimes. But, they prepare you heavily for exams. The exams are very doable if you work on the labs. Would recommend!', 'Taken Fall 2018. Lectures tended to be dry but slow enough to take notes. The 3 exams were consistently a time crunch, but you were allowed a notes sheet so if you know the material inside-out you could finish on time.', 'Homeworks can be done in groups as long as it is one bio major and one CS major. Chad is an amazing lecturer. He assigns academic papers as readings which are very beneficial. Easy A if you are a competent R/python programmer.', ""Very knowledgeable and respected professor in the genomic community. Excellent lectures. Interesting weekly literature readings and class discussions. Make sure to have programming background in Python or R. Application of concepts/methods are done via homeworks. They're long, so start early. No exams. Group project and report assigned towards end."", ""Chad is a great lecturer. His tests are based on lecture notes so you don't even need a textbook. He has 5 projects and they really help you understand the course materials. The only complaint is his midterms are often long and you probably won't have enough time to complete them. He curved the final grade."", 'Great professor - explaining concepts very thoroughly. 5 projects to keep you busy', ""Very approachable and respectable professor. Presents the material in an understandable way and does his best to answer questions fully. Tests are way too long for the 50min you have. Using the excuse for developing quick thinking is fine, but when one of the classes is only writing getter/setter methods it's a waste of time and could be left out."", 'Awesome professor who is extremely caring and willing to go to extreme lengths to help students. I really hope he teaches another Computer Science course that I can take.']}","['Respected', 'Accessible outside class', 'Amazing lectures', 'Clear grading criteria', 'Caring']"
Gopalan Nadathur,1128999,Computer Science,2.1,14%,70,14%,poor,"{'CSCI4011': ['you can do it', 'HW is way harder than material covered in class and questions are so vague so you have to keep going back and forth to office hr for clarification. Grades are not representative at all for the level of understanding of the material since grading is so harsh. Exams are feasible but very tight on time. Not worth the anxiety, I repeat.. not worth it.', ""Absolutely worst professor, no contest. I'm begging you not to take this professor you will seriously regret it. Take anybody else, but him. I both took this class with him for 2041 and 4011. The classes were hw heavy meaning if you don't pass each hw with at least a 50%, you fail. Lectures are terrible, long, and mandatory. Just don't please."", 'Gopalan is by far the most condescending professor in the whole CSCI department. He goes on about wanting to have a good relationship with all his students but he talks down to everyone as if they are less than him. You are better off not interacting with Gopalan at all. Take any other professor and you will be fine.', ""This class is hard, but Gopalan makes it harder. He assumes students are familiar with the course topics so he isn't great at dumbing them down, he can be rude to students who ask questions (though he hasn't been to me yet), a lot of his examples are left unfinished, and the HW/tests are WAY beyond what he actually covers. Thank god for the curve."", ""I'd just like to mention for others that associate with the DRC that he did not accept my Flex DRC accommodations. Now, I'm disabled and I've gotten through to my fourth year of college with a decent GPA, but I have no idea what is going on in this course, it might just be me. I really hope I can drop it. Please think twice about your choice."", 'this class contains a lot of interesting material & valuable information. the only downside is that gopalan has absolutely no idea how to teach any of it. he has terrible communication skills & loves to flaunt that your grade rests in his hands. he refused to tell the class his grading standards and provided no actual help. the TAs fr ran the class', ""Try your best to avoid this professor. Lectures are long and unclear, exams are very difficult and you aren't given enough time to complete them. You're given enough time for the Homework assignments but because the lectures are unclear you're going to either struggle for hours or just go to TA office hours constantly."", 'Lectures are pretty boring but the material is interesting. The homeworks are wordy and frustrating but you do learn a lot about functional programming. Definitely do the labs as they are very similar to the homework and tests.', 'Professor Gopalan is pretty average and quite generous with passing people (class avg. was around 80%, but 55% was passing). HW is challenging, but usually very relevant to lectures. Exams are hard, but he provides a comprehensive mock exam. Difficulty of the course is really related to how well you pick up functional programming concepts.', ""Honestly I think he's a bit underrated here; his lectures can be a bit boring and at too high of a level sometimes, but I feel like he's a pretty average professor; does what he needs to do, explains principles well enough. Most of the learning takes place on your own when working on the HW, but that should be expected for pretty much any CS class."", ""Gop certainly cares about the subject and his students, but does a questionable job at connecting his understanding to the students. The content covered is difficult in its own right, but he doesn't communicate the core concepts concisely, and passes over nuances. Don't take the labs or homework for granted, they are essential in learning material"", ""Gopalan Nadathur is the worst prof I've had at the U to date. Really arrogant and unpleasant person in my opinion. Lectures are honestly hard to stay focused on because of how strong his accent is. The homeworks take a long time, and one of the tests after Covid was super unfair. Does not take student feedback seriously. Avoid this prof at all cost"", 'Man I could write a damn dissertation on how awful of an experience this class was. Lectures? Horrible. Wrote code in illegible writing. Was mean to anyone who asked a question. Homeworks? Way more complex than anything he showed in class. I spent 15+ hours on each hw and averaged 60% Grading? Super unclear. You are set up to fail. STAY AWAY!', ""The material is cool, but somehow Nadathur makes it awful. I performed above average in the class but I also skipped everything I could! He'll talk for what feels like hours about a simple thing, obfuscating it the whole time. He's also not very respectful to struggling students. I never witnessed someone living in an ivory tower until this class."", ""The material is not hard. It really isn't. In fact, functional programming is pretty fun. But somehow he manages to say so much and yet say nothing at all when explaining. Esoteric, confusing, run-on explanations with no purpose. If you absolutely have to take 2041 with him, READ THE CORNELL RECITATIONS ONLINE. Infinitely more lucid and enjoyable.""], 'CSCI5106': ['Gopalan Nadathur is an extremely tough grader and a horrible lecturer. Grading is abysmally harsh the TAs are no help. Solution sketches for the homeworks were vague writeups of the problems with no steps provided. Occasionally, the Professor would refuse to explain random problems. Take this professor if you want anxiety and depression for $2,082', 'He looks very smart, but the lessons he teaches are too bad. Sometimes I wonder how he became a professor. Maybe his academic ability is good, but his teaching ability is 0.'], 'CSCI2041': ['The class material is interesting and professor is well prepare for evrry class hes teaching. The downside is the homework is way too hard and beyond the scope of what was taught on the class. good luck !', 'I have never in my life had a professor this poor at teaching than him. There is a pandemic going on and he is making everything very difficult. He gives more lectures than if classes were in person, is extremely rude to students, and the homeworks rarely cover what that he has talked about in class. Avoid this man like covid-19']}","['Tough grader', 'Lots of homework', 'Test heavy', 'Get ready to read', ""Skip class? You won't pass.""]"
Daniel Orban,2630541,Computer Science,4.2,82%,10,82%,good,"{'CSCI2011': [""He is really nice, dorky in a good way, he finds what he teaches interesting. He is smart but doesn't make you feel dumb for being wrong. And he is generally an easy grader on tests. The homework is LONG. He is a really friendly person I like him"", ""Mr. Orban is a great guy, he really cares about his students. His lectures are very easy, the midterm was very doable, and having no final is always great. The semester-long project got messy in the middle but he made it right and he deserves credit for that. He really knows what he's talking about and loves helping students!"", ""Dr. Orban was in the unenviable position of teaching 3081 his first semester. The class is chaotic and stressful. However, he did everything in his power to help alleviate that stress. He's a super nice guy who's very willing to help and work with you and would spend several hours outside office hours helping people. Bad class, good prof.""], 'CSCI3081W': ['Hes a great guy and a good teacher, but as a professor hes also responsible for the course structure and material. I found the class to be disorganized and frustrating. I think if this had been a more test-heavy class, I wouldve rated him much higher. I would only recommend taking this class with him after hes taught it a few more times.', ""Great dude, well-organized class but not a bad lecturer. He bit off more than the students and staff could chew for the course project. It was clearly too large and complicated for the class. If it wasn't for me getting put in a very good group I may not have passed the class, but I guess now that it's over I do feel I've learned a lot."", ""Dan has been a TA for this class has research and industry experience; so not only is he a good teacher but he is an excellent resource if ur are interested in graphical programming. He is very compassionate and patient with his students. He doesn't make u feel stupid for being wrong. He is a bit new, but every semester the course is more organized"", ""Had him Spring 2021. Lectures sometimes felt a little disorganized, but are pretty interesting in general. Sometimes he would do a proof/problem wrong, but he's quick to fix it. He takes students' viewpoints seriously and dropped some assignments when it got overwhelming. tbh I wish he assigned more problems, but I think most wouldn't complain."", 'Prof. Orban always brought enthusiasm to lectures and took time to connect abstract concepts to real-world applications. Homework assignments were lengthy, but featured interesting problems that had thought put into them. Exams can feature new questions that introduce/build on old concepts, so make sure your foundations are solid. Excellent prof.', ""Dan is a super good guy and it's clear he cares about his students, which is a rarity. The class was very difficult and chaotic, but I felt that Dan did a great job accommodating students and making changes as need be."", ""Dan Orban is the single greatest software development prof ever. He has a passion for design patterns and ties the subject matter to his own past experiences to meet students where they're at. Caring, understanding, approachable, and the nicest prof you'll ever have, don't miss out on the opportunity to learn from him and enjoy awesome projects!"", 'Learned a lot from his lectures & really enjoy going, even online. He is understanding and treats you w/ respect and grace as long as you keep him in the loop with what is going on on your end. I had heard bad things about 3081, but I loved taking it. We use real-world skills and thrown off the deep end but you learn quick, group work setting helps']}","['Caring', 'Group projects', 'Lots of homework', 'Accessible outside class', 'Respected']"
